"id","country","publication_date","source","source_type","headline","headline_mt","m_fr_eco","m_fr_lab","m_fr_wel","m_fr_sec"
878,"Germany","2008-12-06","Frankfurter Rundschau","Print","Gefangen in der Drehtür;
Lage von Flüchtlingen in Griechenland prekär","Caught in the revolving door;
Situation of refugees in Greece precarious",0,0,0,1
879,"Romania","2016-09-03","Ziarul Financiar","Print","Turcia va continua să aplice acordul cu UE privind imigraţia şi cere liberalizarea regimului vizelor","Turkey will continue to implement the agreement with the EU on immigration and calls for visa liberalization",0,0,0,0
880,"Sweden","2015-08-10","Aftonbladet","Print","Polisen går ut med ett signalement på machetemannen i Göteborg","The police issue a signal to the macheteman in Gothenburg",0,0,0,0
881,"Hungary","2016-11-30","Magyar Hirlap","Print","Török miniszter: Igazságtalan az EP állásfoglalása","Turkish Minister: It is unfair to the EP resolution",0,0,0,0
882,"Romania","2017-02-19","Ziarul Financiar","Print","Donald Trump, ironizat după ce a menţionat un presupus incident terorist în Suedia. Fostul premier al Suediei, Carl Bildt, pe Twitter: Suedia, atac terorist? Ce a fumat? Sunt numeroase întrebări","Donald Trump said sarcastically after an alleged terrorist incident in Sweden. Former Prime Minister of Sweden Carl Bildt tweeted: Sweden, terrorist attack? What smoking? There are many questions",0,0,0,1
883,"Romania","2015-05-29","Romania Libera","Print","Şofer român, ARESTAT pentru că transporta imigranţi afgani","Romanian Driver arrested for transporting immigrants Afghan",0,0,0,1
884,"Romania","2017-05-18","Romania Libera","Print","Surse: Sebastian Ghiță ar putea primi azil politic în Serbia, ca să scape de cele patru mandate de arestare care-l așteaptă în România","Sources: Sebastian Ghita could get asylum policy to Serbia to escape the four warrants that awaits in Romania",0,0,0,1
885,"Romania","2013-11-01","Jurnalul National","Print","Emil Constantinescu: Știrile alarmante despre migrația musulmanilor spre Europa, un deficit de înțelegere a moștenirii culturale comune","Emil Constantinescu: alarming news about migration of Muslims into Europe, a lack of understanding of the common cultural heritage",0,0,0,0
886,"UK","2015-09-20","The Guardian","Print","UN warns European unity at risk as borders close to refugees;
Central European neighbours turn ugly as thousands fleeing war are shunted
between Croatia, Slovenia and Hungary","UN warns European unity at risk as borders close to refugees;
Central European neighbours turn ugly as thousands fleeing war are shunted
between Croatia, Slovenia and Hungary",0,0,0,0
887,"Sweden","2009-11-17","Svenska Dagbladet","Print","Skandiaägare i blåsväder","Scandinavian in blue swords",0,0,0,0
888,"Spain","2009-01-16","El Pais","Print","380.000 colombianos y peruanos podrán votar en las próximas municipales","380,000 Colombians and Peruvians will be able to vote in the next municipal elections",0,0,0,0
889,"Poland","2008-09-08","Gazeta Wyborcza","Print","Uchodźcy z Czeczeni nieprzystosowani","Refugees from Chechen are unfit",0,1,1,1
890,"Poland","2017-06-12","Rzeczpospolita","Print","Rośnie konkurencja o Ukraińców","Growing competition for Ukrainians",0,1,0,0
891,"Romania","2015-09-04","Romania Libera","Print","Traian Băsescu, despre criza imigranţilor : România poate să spună NU","Traian Basescu crisis immigrants : Romania can say NO",0,0,0,0
892,"Germany","2014-02-04","taz","Print","Erbitterter Kampf um das Kleingedruckte;
DOPPELPASS Nur Einwandererkinder, die hierzulande aufgewachsen sind, sollen
beide Pässe behalten dürfen. Aber wie weist man das nach? Die CDU-Politikerin
Cemile Giousouf schlägt einen Kompromiss vor","Fierce battle for the fine print;
DOUBLE PASS Only immigrant children who grew up in this country should
to keep both passes. But how do you prove that? The CDU politician
Cemile Giousouf proposes a compromise",0,0,1,0
893,"Sweden","2013-01-04","Dagens Nyheter","Print","Flera knivbråk på asylboende","Several knife fractions on asylum residents",0,0,1,1
894,"UK","2016-02-02","mirror.co.uk","Online","Horrifying video shows moment migrant men 'attack two German pensioners who
stood up for a woman';
The migrants, who appear to be Arabic or Eastern European, are seen grabbing the
men and shouting abuse at them. One of the German men is grasped by the throat","Horrifying video shows moment migrant men 'attack two German pensioners who
stood up for a woman';
The migrants, who appear to be Arabic or Eastern European, are seen grabbing the
men and shouting abuse at them. One of the German men is grasped by the throat",0,0,0,1
895,"Poland","2008-08-31","Gazeta Wyborcza","Print","Potrzebny cud nad Hudson","Need a miracle over Hudson",0,1,0,0
896,"Poland","2008-03-19","Gazeta Wyborcza","Print","Engel: Od Rogera lepszy Cantoro","Engel: Better than Cantor from Roger",0,1,0,0
897,"Hungary","2016-06-23","Magyar Hirlap","Print","Semmi ágán","nothing branch",0,0,0,0
898,"Hungary","2015-04-24","Nepszabadsag","Print","„Bűnözők váltják be Kadhafi fenyegetését","Criminals will be replaced in Gaddafi's threat",0,0,0,1
899,"Sweden","2001-02-06","Expressen","Print","MEDALJENS BAKSIDA","MEDALJENS BAKSIDA",0,1,1,0
900,"Germany","2015-07-21","Spiegel Online","Online","Seehofer verteidigt Asylpläne gegen SPD-Kritik ;","Seehofer defends asylum plans against SPD criticism;",0,0,0,1
901,"Hungary","2016-10-18","Magyar Hirlap","Print","Migránsok egy tehervonaton","Migrants a freight train",0,0,0,1
902,"Spain","2002-06-21","El Pais","Print","EL PRESIDENTE ALEMAN RATIFICA LA POLEMICA LEY DE INMIGRACION","THE GERMAN PRESIDENT RATIFIES THE POLEMIC IMMIGRATION LAW",0,1,0,0
903,"Germany","2015-09-11","Spiegel Online","Online","Tretende Kamerafrau bittet um Entschuldigung ;","Tretende camerawoman apologizes;",0,1,0,0
904,"Spain","2011-02-21","El Mundo","Print","Trípoli intenta silenciar a la UE","Tripoli tries to silence the EU",1,0,0,0
905,"Hungary","2013-07-24","Nepszava","Print","Ideiglenes lesz a tábor Vámosszabadiban","Vamos a temporary camp will be free time",0,0,0,1
906,"Spain","2006-06-01","El Pais","Print","Seis aeronaves y 10 barcos de la UE patrullaran la costa mauritana y senegalesa","Six aircraft and 10 EU ships will patrol the Mauritanian and Senegalese coast",1,0,0,1
907,"Spain","2011-05-26","El Pais","Print","Palabras y poder","Words and power",0,0,0,0
908,"UK","2008-09-19","Metro","Print","MAILMETRO;
The pains in Spain","MAILMETRO;
The pains in Spain",1,0,1,0
909,"Poland","2008-01-31","Rzeczpospolita","Print","Kontrola cudzoziemców","control of foreigners",0,0,0,1
910,"Germany","2007-09-24","taz","Print","IMMER WIEDER SYKE","ALWAYS SYKE",0,0,0,0
911,"Hungary","2016-10-01","Magyar Idök","Print","Felkészült a válsághelyzetre az egészségügyi rendszer","Prepared for the crisis in the health system",0,0,0,0
912,"UK","2012-03-22","telegraph.co.uk","Online","Children who speak English at home in minority;
Children with English as their home language are now the minority of pupils in
more than 1,600 schools across England.","Children who speak English at home in minority;
Children with English as their home language are now the minority of pupils in
more than 1,600 schools across England.",0,0,1,0
913,"Hungary","2016-03-24","Magyar Idök","Print","Az ellenzéki pártok is indokoltnak tartják a terrorkészültséget","Opposition parties also considered the terror alert justified",0,0,0,1
914,"Germany","2012-09-22","taz","Print","Waldorfschule unter staatlichem Dach;
PREMIERE In Hamburg-Wilhelmsburg wollen eine Waldorf-Initiative und eine
staatliche Grundschule fusionieren. Die Stadt will so verhindern, dass eine
Privatschule entsteht, in der die bürgerliche Klientel unter sich bleibt","Waldorf School under state roof;
PREMIERE In Hamburg-Wilhelmsburg want a Waldorf initiative and a
merge state elementary school. The city wants to prevent that from happening
Private school emerges, in which the bourgeois clientele remains among themselves",0,1,1,0
915,"Hungary","2017-01-02","Magyar Hirlap","Print","Az adócsökkentés és a béremelés 2017 legfontosabb céljai között","Among the most important goals of tax cuts and wage increases in 2017",0,0,0,0
916,"Germany","2006-05-02","taz","Print","Das Muskelspiel der Hispanics;
Die Protestbewegung der Latino-Einwanderer verunsichert die USA","The muscular game of Hispanics;
The protest movement of Latino immigrants unsettles the United States",1,1,0,1
917,"Germany","2016-05-31","Frankfurter Rundschau","Print","IS rückt zur türkischen Grenze vor","IS moves to the Turkish border",0,0,1,0
918,"UK","2010-04-12","The Guardian","Print","Amnesty hits out at UK's 'no torture' deals for deportees","Amnesty hits out at UK's 'no torture' deals for deportees",0,0,0,1
919,"Sweden","2016-04-01","Dagens Nyheter","Print","Desperationen växer bland flyktingar i Grekland","Desperation is growing among refugees in Greece",0,0,0,0
920,"Poland","2016-04-01","Rzeczpospolita","Print","Lekarze uciekają z Polski","Doctors flee from Polish",0,0,0,0
921,"Spain","2003-02-13","El Pais","Print","LAS AUTONOMIAS RECONOCEN EL FRACASO DE SUS PLANES PARA INTEGRAR A LOS MENORES
INMIGRANTES MARROQUIES","THE AUTONOMIES RECOGNIZE THE FAILURE OF THEIR PLANS TO INTEGRATE THE MINORS
IMMIGRANTS MARROQUIES",0,0,1,0
922,"Romania","2016-02-24","Ziarul Financiar","Print","Orban: Ungaria convoacă un refrendum pe tema cotelor UE obligatorii de migranţi -2-","Orban: Hungary convenes refrendum EU quotas on compulsory migrants -2-",0,0,0,0
923,"Germany","2006-11-25","Frankfurter Rundschau","Print","Asylbewerberunterkunft    ;
Adventskranz gerät in Brand","Asylum seeker accommodation;
Advent wreath gets on fire",0,0,0,0
924,"Germany","2017-09-05","Welt Online","Online","Ausstellung in Marienborn;
Rück- und Zuwanderung in die DDR","Exhibition in Marienborn;
Return and immigration to the GDR",0,1,1,1
925,"Hungary","2016-05-10","Magyar Hirlap","Print","Brüsszel kilépne Erdogan árnyékából","Brussels exiting Erdogan's shadow",0,0,0,1
926,"Hungary","2017-08-27","Magyar Hirlap","Print","Lakást követeltek maguknak a Rómában tüntető bevándorlók","They demanded an apartment in Rome protesters themselves immigrants",0,0,1,0
927,"Germany","2017-12-18","Welt Online","Online","Österreich;
Verkauft Kurz die Seele der ÖVP?","Austria;
Shortly sells the soul of the ÖVP?",1,0,0,0
928,"Germany","2007-05-18","Frankfurter Rundschau","Print","Anwälte weisen Wege für Migranten    ;
Juristen und Sozialarbeiter bieten seit 29 Jahren Rechtsberatung für Ausländer /
Scheidung häufiges Thema","Lawyers show ways for migrants;
Lawyers and social workers have been providing legal advice to foreigners for 29 years
Divorce frequent topic",0,1,1,0
929,"Spain","2004-01-18","El Pais","Print","'Primitivos' e inmigrantes","'Primitives' and immigrants",0,0,0,0
930,"Spain","2009-10-07","El Pais","Print","20 argelinos escapan tras ser rescatados de una patera en Almería","20 Algerians escape after being rescued from a boat in Almería",0,0,0,1
931,"UK","2006-09-08","Daily Mirror","Print","DEPORT IN A STORM;
LAWYER SLAMS GOVERNMENT OVER BID TO BOOT OUT FOREIGN NATIONALS WHO BREAK LAW
ONCE","DEPORT IN A STORM;
LAWYER SLAMS GOVERNMENT OVER BID TO BOOT OUT FOREIGN NATIONALS WHO BREAK LAW
ONCE",0,1,0,1
932,"Germany","2013-05-25","Frankfurter Rundschau","Print","Der Meister des Baguettes;
Ein aus Tunesien stammender Bäcker darf ein Jahr den Elysée-Palast in Paris
beliefern","The master of the baguette;
A baker from Tunisia is allowed one year the Elysée Palace in Paris
supply",1,1,1,0
933,"UK","2007-03-24","The Guardian","Print","This week Tim Dowling: News From Hungary: Klingons not welcome either","This week Tim Dowling: News From Hungary: Klingons not welcome either",0,0,0,0
934,"Germany","2012-12-15","taz","Print","Die Eltern sind überalarmiert;
INTEGRATION Grundschüler aus Zuwandererfamilien werden besser. Trotzdem meiden
Eltern oft Schulen mit vielen Migranten - zu Unrecht, so Bildungsforscher
Wilfried Bos","The parents are over-alarmed ;
INTEGRATION Elementary school children from immigrant families are getting better. Nevertheless, avoid it
Parents often schools with many migrants - wrongly, according to education researchers
Wilfried Bos",0,0,1,0
935,"Spain","2015-12-15","El Pais","Print","Todos los partidos se olvidan de los inmigrantes en sus listas electorales","All parties forget immigrants on their electoral lists",0,0,0,0
936,"Hungary","2016-04-28","Magyar Hirlap","Print","Vita nélküli vita a terrorelhárításról","debate without debate the terrorelhárításról",0,0,0,1
937,"Poland","2011-07-26","Gazeta Wyborcza","Print","Między „Tangiem a „Emigrantami","Between Tang and Emigrants",0,1,0,0
938,"Poland","2015-06-22","Rzeczpospolita","Print","W skrócie","In brief",0,0,0,0
939,"Spain","2010-07-24","El Pais","Print","Baja el número de alumnos en las aulas separadas para inmigrantes","Drop the number of students in separate classrooms for immigrants",0,0,1,0
940,"Sweden","2003-01-11","Aftonbladet","Print","- Slöddret ska rensas ut","- The slurry must be cleaned out",0,0,0,0
941,"Poland","2017-07-24","Gazeta Wyborcza","Print","Hej, kto z PiS-u, na ludowca!","Hey, who from PiS, a peasant!",0,0,0,0
942,"Germany","2007-02-08","Frankfurter Rundschau","Print","IN KÜRZE","BRIEFLY",0,0,0,0
943,"UK","2015-07-01","Daily Mirror","Print","Fast-track asylum bids","Fast-track asylum bids",0,0,0,0
944,"Spain","2016-04-25","El Pais","Print","Los inmigrantes europeos ganan peso en Barcelona","European immigrants gain weight in Barcelona",0,1,0,0
945,"UK","2004-12-20","The Daily Telegraph","Print","Why I'll be voting in favour of the Identity Cards Bill","Why I'll be voting in favour of the Identity Cards Bill",0,0,0,1
946,"Germany","2002-04-19","Die Welt","Print","Israel beginnt mit Teilrückzug aus Jenin;
UNO ist schockiert über die Zustände im Flüchtlingslager und spricht von einer
humanitären Katastrophe","Israel begins partial withdrawal from Jenin;
UNO is shocked by the conditions in the refugee camp and speaks of one
 humanitarian disaster",0,0,1,0
947,"Romania","2007-12-04","Romania Libera","Print","Romania, pe locul 10 in lume dupa banii trimisi in tara de emigranti","Romania, ranked 10 in the world in remittances sent home by migrants",1,1,0,0
948,"UK","2005-07-27","The Guardian","Print","Reviews: Theatre: The Suppliants: BAC, London 2/5","Reviews: Theatre: The Suppliants: BAC, London 2/5",0,0,0,0
949,"Hungary","2016-01-08","Magyar Hirlap","Print","Káosz volt Kölnben a rendőrök szerint","According to the police was chaos in Cologne",0,0,0,1
950,"Romania","2015-10-14","Ziarul Financiar","Print","UE critică pasivitatea statelor membre în privinţa eforturilor antiimigraţie","EU criticizes the passivity of the Member States in their efforts antiimigraţie",1,0,0,0
951,"Sweden","2003-12-12","Aftonbladet","Print","Fredrik Reinfeldt glömde invandrarna","Fredrik Reinfeldt forgot the immigrants",1,1,0,0
952,"Spain","2003-12-04","El Mundo","Print","Seis argelinos 'sin papeles' denuncian haber recibido una paliza de la policia
de Ceuta.
Los denunciantes, solicitantes de asilo, fueron agredidos mientras dormian en la
playa - Fuentes policiales argumentan que todos se cayeron y se autolesionaron
en la fuga.","Six Algerians 'without papers' report receiving a beating from the police
of Ceuta.
The complainants, asylum seekers, were assaulted while they were sleeping in the
beach - Police sources argue that all  fell and self-injured
in the escape .",0,0,0,0
953,"UK","2008-08-22","The Daily Telegraph","Print","Eastern European slowdown","Eastern European slowdown",1,1,0,0
954,"Hungary","2015-12-04","Magyar Hirlap","Print","Kampány indul a betelepítésekről","Campaign start the introductions",0,0,0,1
955,"Romania","2015-05-03","Ziarul Financiar","Print","Aproape 3.700 de imigranţi clandestini salvaţi pe Mediterana într-o singură zi","Almost 3,700 immigrants illegal Mediterranean save in one day",0,0,0,1
956,"Romania","2015-11-30","Romania Libera","Print","Klaus Iohannis participă, luni, la summitul pentru mediu de la Paris","Johannis participate Monday at the Paris Summit for the Environment",0,0,0,0
957,"Sweden","2008-04-06","Dagens Nyheter","Print","Papperslösa fick studentstöd","Paperless received student support",0,0,1,1
958,"Romania","2015-09-18","Romania Libera","Print","Criza imigranților : Klaus Iohannis va participa la Consiliul extraordinar de la Bruxelles","Crisis immigrants : Johannis will attend the extraordinary Council meeting in Brussels",0,0,0,0
959,"Romania","2015-04-23","Evenimentul Zilei","Print","Preşedintele Iohannis, la reuniunea extraordinară a Consiliului European","President Johannis, the extraordinary meeting of the European Council",0,0,0,0
960,"Poland","2008-06-26","Gazeta Wyborcza","Print","Przemyskie przedszkolaki z prezentami dla uchodźców","Przemyskie przedszkolaki with presents for refugees",0,0,0,0
961,"Poland","2014-06-30","Rzeczpospolita","Print","Bardzo luksusowo i drogo","Very luxurious and expensive",0,1,0,0
962,"Romania","2017-01-15","Ziarul Financiar","Print","Aproximativ 100 persoane au dispărut după ce o barcă cu imigranţi s-a scufundat în largul Libiei","About 100 people were missing after a boat with migrants sank off Libya",0,0,0,0
963,"UK","2016-06-30","The Daily Telegraph","Print","Gove's wife warns him about risk of backing Boris in leaked email;
BRE IT ; Sarah Vine tells husband to secure guarantees on immigration controls
as the price of his support ; Contenders line up as rivals to Boris for party
leadership","Gove's wife warns him about risk of backing Boris in leaked email;
BRE IT ; Sarah Vine tells husband to secure guarantees on immigration controls
as the price of his support ; Contenders line up as rivals to Boris for party
leadership",0,0,0,0
964,"Hungary","2017-12-22","Magyar Idök","Print","Több a botrány, kevesebb a támogató a Jobbiknál","Several of the scandal, the less support Jobbiknál",0,0,0,0
965,"Poland","2012-08-09","Rzeczpospolita","Print","Imigranci odsyłani z Grecji","Immigrants sent back from Greece",0,0,0,1
966,"UK","2000-02-12","The Guardian","Print","UN agency failed to meet refugee crisis, says report","UN agency failed to meet refugee crisis, says report",1,0,0,0
967,"Sweden","2016-07-22","Aftonbladet","Print","Fem år senare ses öppenhet som fult","Five years later, openness is seen as ugly",0,0,1,0
968,"Spain","2001-01-28","El Pais","Print","LOS ALCALDES DEL PSOE PIDEN MAS COMPETENCIAS SOBRE INMIGRACION","THE MAYORS OF THE PSOE ASK FOR MORE SKILLS ABOUT IMMIGRATION",0,0,1,0
969,"Sweden","2016-12-15","Expressen","Print","En iskall vinter","An ice cold winter",1,0,1,0
970,"Sweden","2015-04-29","Svenska Dagbladet","Print","Utlänningar avrättade i Indonesien","Foreigners executed in Indonesia",0,0,0,1
971,"UK","2015-09-11","The Daily Telegraph","Print","Refugees get free passage through Denmark;
Northern neighbours attack Copenhagen's decision to abandon registration of new
arrivals","Refugees get free passage through Denmark;
Northern neighbours attack Copenhagen's decision to abandon registration of new
arrivals",0,0,0,1
972,"UK","2009-05-16","The Guardian","Print","Saturday Review: FICTION: The lost: Stevie Davies applauds a sympathetic
portrayal of modern London's immigrant underclass: Hearts and Minds by Amanda
Craig 422pp, Little, Brown, £17.99","Saturday Review: FICTION: The lost: Stevie Davies applauds a sympathetic
portrayal of modern London's immigrant underclass: Hearts and Minds by Amanda
Craig 422pp, Little, Brown, £17.99",0,1,0,1
973,"Spain","2006-12-28","El Mundo","Print","BALANCE DE 2006 / LA CIUDAD DEL ANO.
El record.","BALANCE OF 2006 / THE CITY OF THE YEAR.
The record",0,0,0,1
974,"UK","2014-05-13","telegraph.co.uk","Online","British asian Ukip youth leader quits 'racist' and 'terrifying' Ukip;
Sanya-Jeet Thandi, who defended her support of Ukip on Channel Four news, says
the party is now appealing to 'stupidity of ignorant anti-immigrant voters for
electoral gain'","British asian Ukip youth leader quits 'racist' and 'terrifying' Ukip;
Sanya-Jeet Thandi, who defended her support of Ukip on Channel Four news, says
the party is now appealing to 'stupidity of ignorant anti-immigrant voters for
electoral gain'",0,1,0,0
975,"Sweden","2008-08-18","Svenska Dagbladet","Print","Invandrare startar ofta företag utan lån","Immigrants often start companies without loans",0,1,0,0
976,"Hungary","2016-12-21","Magyar Hirlap","Print","„Sorostalanítanák Macedóniát","Sorostalanítanák Macedonia",0,0,0,0
977,"Hungary","2011-06-27","Nepszabadsag","Print","Tibetieket zaklattak","Tibetans were harassed",0,1,0,0
978,"Sweden","2015-08-29","Aftonbladet","Print","Okänd pojke har dött på sjukhuset","Unknown boy died in the hospital",0,0,0,0
979,"Hungary","2010-08-27","Nepszabadsag","Print","Folytatódik a cigányok kitoloncolása","Continue the expulsion of Gypsies",0,0,0,0
980,"Romania","2016-07-21","Evenimentul Zilei","Print","Harta MIGRAŢIEI . Cum au fost „CUCERITE de alte popoare statele Europei","Map MIGRATION . How were conquering other people European countries",0,0,0,0
981,"Spain","2005-01-13","El Pais","Print","Espana pedira a la UE que financie un sistema de radares en Marruecos","Spain will ask the EU to finance a radar system in Morocco",0,0,0,0
982,"Poland","2011-05-18","Rzeczpospolita","Print","Co Holandia zrobi z Polakami","Netherlands What to do with the Poles",0,1,1,1
983,"Romania","2012-08-16","Ziarul Financiar","Print","Marea Britanie ameninţă Ecuadorul că va lua cu asalt ambasada de la Londra dacă nu îl predă pe fondatorul Wikileaks","UK threatens to storm Ecuador that will embassy in London if not hand over WikiLeaks founder",0,0,0,1
984,"Poland","2008-01-16","Gazeta Wyborcza","Print","Beenhakker skarciłby Cieślaka","Beenhakker would scold Cieślak",0,1,0,0
985,"Poland","2017-01-18","Rzeczpospolita","Print","Boom na informatyków z importu","Boom for IT specialists from import",0,1,0,0
986,"Romania","2015-09-30","Romania Libera","Print","Ponta, vizită în Iordania. Câți bani i-a dat România pentru criza refugiaților","Ponta visit to Jordan. How much money gave Romania the crisis of refugees",1,0,0,0
987,"Poland","2016-09-21","Rzeczpospolita","Print","Ryzykowna elastyczna solidarność","Risky flexible solidarity",1,0,1,1
988,"Poland","2007-05-21","Gazeta Wyborcza","Print","Jeden z zabitych pod Trypolisem bojowników był poszukiwany za próbę zamachu w
Niemczech","One of the militants killed under Trypolis was wanted for attempting a coup in
Germany",0,0,0,1
989,"UK","2014-08-09","Daily Mirror","Print","BLASTED BY OBOMBA;
MELTDOWN IN MIDDLE EAST: SAS IN WAR ON JIHADIS US jets pound militants as
humanitarian crisis escalates Brit special forces sent in to help rescue
refugees","BLASTED BY OBOMBA;
MELTDOWN IN MIDDLE EAST: SAS IN WAR ON JIHADIS US jets pound militants as
humanitarian crisis escalates Brit special forces sent in to help rescue
refugees",0,0,1,0
990,"Germany","2017-09-26","Welt Online","Online","Bayerischer Flüchtlingsrat befürchtet schärfere Asylpolitik","Bavarian Refugee Council fears sharper asylum policy",0,0,0,0
991,"Spain","2009-06-16","ABC","Print","Rubalcaba no es «muy partidario» de revisar las competencias en la tutela de los
menores inmigrantes","Rubalcaba is not very much in favor of reviewing competences in the protection of
immigrant minors",0,0,1,0
992,"Poland","2011-05-25","Rzeczpospolita","Print","Wizyta starszej pani","Visit the old lady",0,0,0,0
993,"Spain","2008-08-06","ABC","Print","La sonrisa de un niño","The smile of a child",0,0,1,0
994,"Sweden","2014-06-14","Svenska Dagbladet","Print","Eva Winther","Eva Winther",0,0,0,0
995,"Poland","2013-12-20","Rzeczpospolita","Print","Dzieciństwo bez matki","Childhood without a mother",0,1,1,0
996,"Hungary","2016-01-07","Nepszabadsag","Print","Sokan elhagyják majd az országot","Many will leave the country",0,1,1,0
997,"Romania","2016-12-07","Romania Libera","Print","Leonard Orban: Brexitul este o problemă serioasă. E un proces omplicat care ridică multe probleme administrative, cât și politice la nivelul UE","Leonard Orban: Brexitul is a serious problem. It is a process which raises many issues omplicat administrative, political and EU",0,0,0,0
998,"Hungary","2016-06-10","Nepszabadsag","Print","A béremelés nem fogja megállítani az egészségügyisek elvándorlását","The pay rise will not stop in Health care professionals migration",1,1,0,0
999,"Sweden","2014-08-30","Svenska Dagbladet","Print","Riskkapitalets nya guldkorn","Risk capital's new gold grain",0,0,0,0
1000,"Poland","2007-10-31","Gazeta Wyborcza","Print","Chiny: wojsko ostrzelało uciekających do Nepalu Tybetańczyków","China: the army fired at the Tibetans fleeing to Nepal",0,0,1,0
1001,"Poland","2007-12-26","Gazeta Wyborcza","Print","Od czwartku licytujemy pamiątki z granic!","From Thursday we are offering souvenirs from the borders!",0,0,1,0
1002,"Spain","2007-02-16","El Pais","Print","Trabajo investiga la situación laboral de las modelos","Work investigates the work situation of the models",0,1,0,0
1003,"Hungary","2017-10-17","Nepszava","Print","Nyomasztásból gyűlölet","Nyomasztásból hatred",0,1,0,0
1004,"Hungary","2016-07-30","Nepszabadsag","Print","Orbán forradalomra készül Európában, átvenné a vezetést is","Orban Europe is a revolution, it would take over the lead",0,0,0,1
1005,"Poland","2008-02-27","Gazeta Wyborcza","Print","800 tys. imigrantów z Europy Wsch. próbowało zarejestrować się do pracy","800 thousand immigrants from Eastern Europe tried to register for work",0,1,1,0
1006,"UK","2001-05-19","Daily Mirror","Print","ELECTION 2001: ELECTION WATCH;
 THE ALTERNATIVE GUIDE","ELECTION 2001: ELECTION WATCH;
 THE ALTERNATIVE GUIDE",0,0,0,0
