"id","country","publication_date","source","source_type","headline","headline_mt","m_fr_eco","m_fr_lab","m_fr_wel","m_fr_sec"
2512,"UK","2015-10-05","The Guardian","Print","Natacha Bouchart is wrong: Britain is no El Dorado for asylum seekers;
The mayor of Calais is misguided to suggest that migrants are 'prepared to die'
for benefits. The UK has welcomed far fewer than some of its EU partners","Natacha Bouchart is wrong: Britain is no El Dorado for asylum seekers;
The mayor of Calais is misguided to suggest that migrants are 'prepared to die'
for benefits. The UK has welcomed far fewer than some of its EU partners",1,0,1,0
2513,"Romania","2016-09-16","Ziarul Financiar","Print","Premierul Ungariei, Viktor Orban: Summitul UE nu a reuşit modificarea politicilor naive în materie de imigraţie","Hungarian Prime Minister Viktor Orban: EU summit failed to change naive immigration policies",0,0,0,0
2514,"Romania","2016-04-18","Ziarul Financiar","Print","Mai multe sute de imigranţi au murit într-o nouă tragedie în Marea Mediterană","Several hundred immigrants died in a new tragedy in the Mediterranean",0,0,0,0
2515,"UK","2013-11-28","The Daily Telegraph","Print","Boris: Some people too stupid to get on","Boris: Some people too stupid to get on",1,0,0,0
2516,"Romania","2016-03-10","Ziarul Financiar","Print","Comisia Europeană îndeamnă statele europene să accepte relocarea a 6.000 de refugiaţi lunar","European Commission urges European states to accept the relocation of 6,000 refugees per month",0,0,0,0
2517,"Spain","2008-06-13","ABC","Print","Avalancha de críticas a la Junta por su giro político con los menores
inmigrantes Múgica dice que la circular instando a dilatar la declaración de
desamparo va contra la Ley del Menor y Chamizo recuerda a la Consejería que es
obligatoria","Avalanche of criticism of the Board for its political turn with the minors
Immigrants says that the circular urging to delay the declaration of
helplessness goes against the Law of the Minor and Chamizo reminds the Ministry that is
obligatory",0,0,1,0
2518,"Poland","2016-10-28","Rzeczpospolita","Print","Ukraińcy ratują polskie PKB","Ukrainians are saving Polish GDP",1,1,0,0
2519,"UK","2010-09-21","The Daily Telegraph","Print","Europe's worrying trend;
THE DAILY TELEGRAPH Established 1855","Europe's worrying trend;
THE DAILY TELEGRAPH Established 1855",1,1,0,1
2520,"Germany","2017-02-09","taz","Print","Migration: Europa mauert;
FLÜCHTLINGSPOLITIK Beim europäisch-afrikanischen Gipfel prallen
Missverständnisse aufeinander. Die einen wollen weniger illegale Migration, die
anderen mehr legale","Migration: Europe walls;
REFUGEE POLICY The European-African summit bounces
Misunderstandings on each other. Some want less illegal migration
others more legal",0,1,1,1
2521,"UK","2015-10-21","The Guardian","Print","Right to rent scheme to be extended nationwide from February;
During six-month pilot in West Midlands, 109 people who were in Britain
illegally were identified as a result of compulsory checks on new tenants","Right to rent scheme to be extended nationwide from February;
During six-month pilot in West Midlands, 109 people who were in Britain
illegally were identified as a result of compulsory checks on new tenants",1,0,0,1
2522,"Hungary","2016-09-08","Magyar Idök","Print","Bevándorlás : Ausztria perelné hazánkat","Immigration : Austria sue Hungary",0,0,0,1
2523,"Sweden","2004-09-05","Aftonbladet","Print","­ Jag vill skildramaktens män","I want the men's men's drama",0,1,0,0
2524,"UK","2008-02-14","Daily Mirror","Print","IMMIGRANT RIGHTS PLEA","IMMIGRANT RIGHTS PLEA",0,0,0,0
2525,"Sweden","2002-10-05","Svenska Dagbladet","Print","Kriminella avvisas snabbare","Criminals are rejected more quickly",0,0,0,1
2526,"Romania","2016-11-03","Romania Libera","Print","Consiliul Europei îi cere Ungariei să nu recurgă la rele tratamente contra migranților","Council of Europe asks Hungary to refrain from ill-treatment against migrants",0,0,0,0
2527,"Poland","2009-07-23","Rzeczpospolita","Print","Kto ocali cnotę Evelyn Duenas","Who will save the virtue of Evelyn Duenas",0,1,0,0
2528,"Sweden","2011-11-23","Dagens Nyheter","Print","Fler kommer för att jobba","More are coming to work",0,1,0,0
2529,"UK","2016-02-10","The Guardian","Print","Turkey dismisses EU plan to resettle refugees in return for sealing sea route;
Ankara's ambassador to EU describes plan to take in refugees from Turkey only if
Aegean sea route is closed as unacceptable and infeasible","Turkey dismisses EU plan to resettle refugees in return for sealing sea route;
Ankara's ambassador to EU describes plan to take in refugees from Turkey only if
Aegean sea route is closed as unacceptable and infeasible",0,0,0,0
2530,"Sweden","2014-12-03","Svenska Dagbladet","Print","Starkt tryck från gräsrötter","Strong pressure from grass roots",1,1,0,0
2531,"Germany","2017-09-12","Welt Online","Online","Prozess gegen Terrorverdächtige;
Wir sollten uns so verhalten wie die Flüchtlinge","Trial of terrorist suspects;
 We should behave like the refugees",0,0,0,1
2532,"Sweden","2013-09-11","Dagens Nyheter","Print","Dyrköpt omväxling","Cultivated variety",1,0,0,0
2533,"Poland","2017-11-04","Gazeta Wyborcza","Print","Czy w berlińskiej akademii policyjnej uczą się ludzie tureckich i arabskich
gangów? Anonimowy donos postawił Niemców na nogi","Are Turkish and Arab people learning at the Berlin police academy?
gangs? Anonymous denunciation put the Germans on their feet",0,1,0,0
2534,"Poland","2008-07-25","Gazeta Wyborcza","Print","Wycieczka za ostatnią żelazną kurtynę","A tour of the last iron curtain",0,0,0,0
2535,"Sweden","2000-10-06","Expressen","Print","Tandtrollen härjar","The floss rages",0,0,1,0
2536,"Spain","2004-08-22","El Pais","Print","Rumi dice que se daran papeles a los extranjeros con contrato que el PP dejo en
la ilegalidad","Rumi says that they will give papers to foreigners with a contract that the PP left in
illegality",0,1,1,0
2537,"Hungary","2017-04-06","Magyar Hirlap","Print","Szilágyi Péter: Budapest gazdaságfejlesztéssel is segíti a kárpátaljai magyarság megmaradását","Peter Szilagyi: Budapest promotes the survival of the Sub-economic development is",0,1,0,0
2538,"Germany","2002-08-05","taz","Print","Demo für Einwanderer;
in kürze FRANKREICH","Demo for immigrants;
shortly FRANCE",0,0,0,0
2539,"Spain","2002-01-11","El Pais","Print","CONDENADO UN HOMBRE QUE TRASLADABA EN AMBULANCIA A INMIGRANTES DESDE CEUTA","CONDEMNED A MAN WHO TRANSFERED AMBULANCE TO IMMIGRANTS FROM CEUTA",0,0,1,1
2540,"Hungary","2017-04-12","Magyar Hirlap","Print","Feleannyi menekült vágyik Hollandiába, mint tavaly","Half the refugees want to Holland than last year",0,0,0,0
2541,"Poland","2015-09-16","Rzeczpospolita","Print","Sporne słowo dobrowolnie","The disputed word voluntarily",0,0,0,1
2542,"Romania","2015-09-07","Evenimentul Zilei","Print","Angela Merkel: Germania poate face faţă valului de refugiaţi fără să crească taxele!","Angela Merkel: Germany can cope with the wave of refugees without increasing taxes!",1,1,1,0
2543,"Germany","2008-06-13","taz","Print","Toter bei Brand in Asylheim","Dead at fire in Asylheim",0,0,0,0
2544,"Spain","2005-10-11","El Pais","Print","Alonso reclama la implicacion de la ONU y de Europa en la inmigracion
subsahariana","Alonso demands the involvement of the UN and Europe in immigration
Sub-Saharan",0,0,0,0
2545,"Germany","2016-10-30","Welt Online","Online","Wirtschaft;
Ernüchterung über Impulse durch Flüchtlinge","Economy;
Disillusionment about impulses from refugees",1,1,1,0
2546,"Spain","2008-01-08","El Pais","Print","Más muertos y más menores","More dead and more minors",0,0,0,1
2547,"UK","2017-08-09","The Guardian","Print","Manus Island asylum seeker death: family want autopsy in Australia;
Family say foul play can't be ruled out in Hamed Shamshiripour's death, whose
deteriorating mental health issues had been raised high up in immigration
department","Manus Island asylum seeker death: family want autopsy in Australia;
Family say foul play can't be ruled out in Hamed Shamshiripour's death, whose
deteriorating mental health issues had been raised high up in immigration
department",0,0,1,1
2548,"Sweden","2000-04-27","Dagens Industri","Print","800 000 nya jobb i Italien på tvåår","800 000 new jobs in Italy in two years",0,1,0,0
2549,"UK","2005-09-02","The Daily Telegraph","Print","In a measured Yorkshire accent, the July 7 suicide bomber delivers his message
of hate","In a measured Yorkshire accent, the July 7 suicide bomber delivers his message
of hate",0,0,1,0
2550,"Germany","2002-08-03","taz","Print","Türöffner für die Wirtschaft;
Oldenburg macht Zuwanderer zu Industrieberatern","Door opener for the economy;
Oldenburg turns immigrants into industry advisors",1,1,1,0
2551,"Poland","2004-03-22","Gazeta Wyborcza","Print","Sylwetka szejka Ahmeda Jasina - lidera Hamasu","The silhouette of Sheikh Ahmed Ya'in - the leader of Hamas",0,0,1,0
2552,"Poland","2008-05-26","Gazeta Wyborcza","Print","Europopyt na Polaka","Europopyt for a Pole",1,1,0,1
2553,"Germany","2015-12-07","Welt Online","Online","Dienst nach Vorschrift;
Altmaier und Nahles verteidigen BAMF-Mitarbeiter","Call of duty;
Altmaier and Nahles defend BAMF employees",0,1,0,0
2554,"Hungary","2016-09-09","Nepszava","Print","Bekeményítene Seehofer","Bekeményítene Seehofer",0,0,0,0
2555,"Hungary","2014-10-27","Nepszabadsag","Print","Házhoz jön a terror","House comes to terror",0,0,0,1
2556,"UK","2016-05-19","The Guardian","Print","Human traffickers 'using migration crisis' to force more people into slavery;
EU report warns that children have become preferred target for criminal gangs
amid concern over thousands of minors disappearing from official view","Human traffickers 'using migration crisis' to force more people into slavery;
EU report warns that children have become preferred target for criminal gangs
amid concern over thousands of minors disappearing from official view",0,1,1,1
2557,"Poland","2011-03-07","Rzeczpospolita","Print","Eurosieroty potrzebują patronów w kraju","Eurosieroty need patrons in the country",0,0,0,0
2558,"Germany","2001-12-06","taz","Print","Folgenreicher Asylantrag","Successful asylum application",0,0,0,0
2559,"Hungary","2017-07-06","Magyar Idök","Print","Az új családtámogatási program margójára","The new family support program in the margin",0,1,1,1
2560,"UK","2002-07-24","Daily Mirror","Print","GARDAI SWOOP ON 101 ILLEGALS;
 IMMIGRANTS HELD AFTER SERIES OF DAWN RAIDS","GARDAI SWOOP ON 101 ILLEGALS;
 IMMIGRANTS HELD AFTER SERIES OF DAWN RAIDS",0,0,0,1
2561,"Romania","2015-09-25","Ziarul Financiar","Print","Adevărul negru din spatele primirii refugiaţilor sirieni în Germania: Imigranţi est-europenii plătesc preţul şi sunt deportaţi pe capete","Black truth behind receiving refugees Syrian in Germany: Immigrants Eastern Europeans are paying the price and deported ends",1,1,0,0
2562,"Hungary","2016-03-01","Nepszava","Print","Kitart a német kancellár","Sticking to German Chancellor",1,0,0,1
2563,"Spain","2009-06-02","ABC","Print","Clinton afirma que con Cuba «hemos avanzado mucho más que en años» Mauricio
Funes anuncia en su toma de posesión el «inmediato» restablecimiento de
relaciones diplomáticas con La Habana","Clinton affirms that with Cuba we have advanced much more than in years Mauricio
Funes announces in his inauguration the immediate restoration of
diplomatic relations with Havana",1,0,0,0
2564,"Romania","2016-05-13","Ziarul Financiar","Print","Oficial ungar: Respingerea cotelor obligatorii de migranţi nu înseamnă un vot îndreptat împotriva UE","Hungarian Official Rejection mandatory quotas of migrants is not directed against EU vote",0,0,0,0
2565,"Sweden","2013-07-17","Expressen","Print","RYSSLAND LOVAR LÄMNA BESKED","RUSSIA LOVES LÄMN BESKED",0,0,0,1
2566,"UK","2000-11-30","The Guardian","Print","New 'Bosman' raises fears of influx","New 'Bosman' raises fears of influx",0,1,0,0
2567,"Poland","2001-04-24","Rzeczpospolita","Print","Rosyjski ślad emigracji","The Russian trace of emigration",0,0,0,1
2568,"Poland","2016-01-08","Rzeczpospolita","Print","Obrońcy demokracji jak Jaruzelski","The defenders of democracy as Jaruzelski",0,1,0,1
2569,"UK","2007-01-23","Daily Mirror","Print","FOOTBALL: FOREIGN LEGION TO AID AIDY;
WATFORD V BLACKBURN, TONIGHT, 7.45PM","FOOTBALL: FOREIGN LEGION TO AID AIDY;
WATFORD V BLACKBURN, TONIGHT, 7.45PM",0,1,0,0
2570,"UK","2017-10-08","Daily Mirror","Print","It's time to put an end to racism;
VOICE OF THE","It's time to put an end to racism;
VOICE OF THE",0,1,0,0
2571,"Romania","2007-12-06","Ziarul Financiar","Print","Tariceanu in FT: Britanicii sunt nerealisti in privinta imigratiei","Tariceanu FT: Britons are unrealistic about immigration",0,1,0,0
2572,"Romania","2015-11-25","Ziarul Financiar","Print","Premierul Franţei: UE nu trebuie să mai primească imigranţi","French Prime Minister: EU should no longer receive immigrants",0,0,0,1
2573,"Sweden","2014-12-28","Expressen","Print","En anka i tiden","A duck in time",0,0,0,0
2574,"Sweden","2015-11-01","Svenska Dagbladet","Print","Fakta och sans, ej lögner och rädsla","Fact and sense, not lies and fear",0,0,0,0
2575,"Romania","2015-08-26","Evenimentul Zilei","Print","Gabriel Oprea a convocat un Comitet de Urgenţă pe tema imigranţilor","Gabriel Oprea convened an emergency committee on immigrants",0,0,0,0
2576,"Poland","2007-05-25","Gazeta Wyborcza","Print","W Bejrucie wylądowały pierwsze samoloty z pomocą wojskową","The first planes with military assistance landed in Beirut",0,0,0,0
2577,"Sweden","2013-03-14","Dagens Nyheter","Print","MP hotar att bryta regeringssamarbete","MP threatens to break government cooperation",0,0,0,1
2578,"Romania","2016-11-18","Romania Libera","Print","Ministrul slovac de interne: distribuția imigranților în UE este deficitară","Slovak Interior Minister: distribution of immigrants in the EU is poor",0,0,0,0
2579,"Romania","2014-06-26","Romania Libera","Print","Băsescu merge la Consiliul European: Voi ridica din nou problema accesului României la Spațiul Schengen","Basescu goes to the European Council I will raise again the issue of Romania's access to the Schengen Area",0,0,0,0
2580,"Romania","2017-03-23","Ziarul Financiar","Print","Premierul Poloniei consideră că atacul de la Londra are legătură cu politicile UE privind migraţia","Polish prime minister believes that the attack on London is related to EU policies on migration",0,0,0,1
2581,"Germany","2017-05-18","Welt Online","Online","Zwei Flüchtlingsprojekte erhalten eine halbe Million Euro","Two refugee projects receive half a million euros",1,0,1,0
2582,"Hungary","2016-10-09","Magyar Hirlap","Print","Bakondi György: Drasztikusan romlott Európa belső biztonsága","György Bakondi: Europe's internal security has deteriorated drastically",0,0,0,1
2583,"Poland","2016-09-22","Gazeta Wyborcza","Print","Węgierski układ wizowy. Na czym zarabiają ludzie Orbána?","Hungarian visa system. What do Orbán's people earn?",0,0,0,0
2584,"UK","2014-05-29","The Daily Telegraph","Print","SNP expects record level of migrants","SNP expects record level of migrants",1,1,1,0
2585,"UK","2017-09-26","telegraph.co.uk","Online","Labour Party conference day three live: Emily Thornberry suggests Labour could
back continued freedom of movement post-Brexit","Labour Party conference day three live: Emily Thornberry suggests Labour could
back continued freedom of movement post-Brexit",0,0,0,0
2586,"Poland","2008-02-23","Gazeta Wyborcza","Print","Bezpieka z Wietnamu w Polsce","Bezpieka from Vietnam in Poland",0,0,0,0
2587,"Germany","2000-12-28","Die Welt","Print","Nach Guben fordert Brandenburg schärferes Jugendstrafrecht;
Justizminister Schelter: Abschreckung verstärken","According to Guben, Brandenburg demands stricter youth criminal law;
Minister of Justice Schelter: strengthen deterrence",0,1,1,0
2588,"Sweden","2011-11-19","Svenska Dagbladet","Print","EU vill gå över gränsen","The EU wants to cross the border",0,1,1,0
2589,"Hungary","2017-07-07","Magyar Idök","Print","Ellenzéki össztűz zúdul a Fideszre","Total fire descend opposition Fidesz",0,0,0,1
2590,"Poland","2014-08-29","Rzeczpospolita","Print","Więcej praw dla uchodźców","More rights for refugees",0,0,1,0
2591,"UK","2002-07-06","The Daily Telegraph","Print","HIV refugee in plea for free baby milk","HIV refugee in plea for free baby milk",0,0,1,0
2592,"Romania","2017-11-01","Evenimentul Zilei","Print","Doi cetățeni BULGARI, periculoși, ARESTAȚI la Constanța pentru de TRAFIC DE MIGRANȚI","Two Bulgarian, dangerous, Constance arrested for trafficking MIGRANTS",0,0,0,1
2593,"Sweden","2009-01-17","Svenska Dagbladet","Print","Flopp för facklig hemsida","Flop for union website",0,1,0,1
2594,"Sweden","2011-07-23","Svenska Dagbladet","Print","Invandringspolitik med samhällsnytta","Immigration policy with social benefits",1,1,1,0
2595,"Poland","2007-11-21","Gazeta Wyborcza","Print","Licytacja izraelsko-palestyńska","Israeli-Palestinian bidding",0,0,0,0
2596,"Hungary","2017-03-18","Magyar Idök","Print","Ankara kezében Európa","Ankara hands of Europe",0,0,0,0
2597,"Germany","2009-08-01","Frankfurter Rundschau","Print","Kreuzritter als Brückenbauer;
Anders Fogh Rasmussen hat in der islamischen Welt keinen guten Ruf","Crusader as bridge builder;
Anders Fogh Rasmussen does not have a good reputation in the Islamic world",0,0,0,0
2598,"Romania","2014-09-15","Romania Libera","Print","Pescador cu peste 100 de migranți la bord, salvat de Garda de Coastă","Pescador over 100 migrants on board, Coast Guard rescued",0,0,0,0
2599,"Sweden","2000-11-06","Dagens Industri","Print","Rakt på sak: Så tar samhället knäcken på folk","Reason for things: So society is breaking the crowd",1,1,1,0
2600,"Sweden","2003-07-31","Dagens Nyheter","Print","Asylsökande slogs ner - nu väcks åtal","Asylum seekers fought down - now prosecution is being woken",0,0,0,0
2601,"UK","2012-08-15","The Daily Telegraph","Print","Illegal immigrant jailed for £47,000 benefit scam;
In Brief","Illegal immigrant jailed for £47,000 benefit scam;
In Brief",0,0,1,1
2602,"Romania","2016-12-20","Ziarul Financiar","Print","Poliţia germană a efectuat o razie la un fost aeroport din Berlin unde sunt cazaţi refugiaţi","German police raided a former airport in Berlin where they are accommodated refugees",0,0,0,1
2603,"Hungary","2017-08-18","Magyar Idök","Print","Remény és erő","Hope and strength",0,0,0,1
2604,"Romania","2014-02-19","Ziarul Financiar","Print","Londra vrea ca imigranţii care nu câştigă 150 de lire pe săptămână să nu primească acces la beneficii sociale","London wants immigrants who earns 150 pounds a week may not be granted access to social benefits",1,1,1,0
2605,"Romania","2016-01-03","Ziarul Financiar","Print","Cincizeci şi şapte de imigranţi , care se îndreptau spre Grecia, salvaţi de pe Marea Egee","Fifty-seven immigrants who were heading for Greece, save Aegean",0,0,0,0
2606,"Hungary","2017-10-19","Magyar Hirlap","Print","Spanyolországban megduplázódott az illegális határátlépések száma","Spain has doubled the number of illegal border crossings",0,0,0,1
2607,"Poland","2010-12-02","Rzeczpospolita","Print","Młodzi Turcy opuszczają Niemcy","Young Turks leaving Germany",0,1,1,0
2608,"Hungary","2017-07-10","Magyar Idök","Print","Szijjártó: A V4 soha nem volt ennyire hatékony","Szijjártó: The V4 has never been so efficient",0,0,0,1
2609,"Germany","2000-11-10","taz","Print","Weniger Asylantraege;
  in kuerze","Fewer asylum applications;
briefly",0,0,0,0
2610,"Hungary","2017-03-14","Magyar Idök","Print","Távollétében ítélik el a migránst","Convicted in absentia migrants",0,0,0,1
2611,"Romania","2015-04-24","Evenimentul Zilei","Print","Iohannis a încurcat mările la Consiliul Europei | VIDEO","Johannis confused seas the Council of Europe | VIDEO",1,0,0,0
2612,"Germany","2013-06-26","taz","Print","Flüchtlinge gehen in Trinkstreik;
ASYLBEWERBER IN MÜNCHEN","Refugees go on a drinking strike;
ASYLUM PLAYERS IN MUNICH",0,0,0,0
2613,"Sweden","2009-05-15","Dagens Nyheter","Print","Svårare få bra vård för lågutbildade och invandrare","Difficult to get good care for low-skilled and immigrants",0,0,1,0
2614,"Sweden","2004-11-06","Aftonbladet","Print","Besvikna väljare vill till Kanada","Disappointed voters want to Canada",0,0,0,0
2615,"Spain","2010-01-24","ABC","Print","Inmigracion y fanatismo","Immigration and bigotry",1,1,0,0
2616,"Germany","2017-03-10","taz","Print","Nur ein Grüner macht mit;
ASYL Winfried Kretschmann will die Maghrebländer gemeinsam mit CDU und CSU zu
sicheren Herkunftsstaaten  machen. Im Bundesrat hat das Gesetz aber keine
Mehrheit","Only a green person joins in;
ASYL Winfried Kretschmann wants to join the Maghreb countries together with CDU and CSU
safe countries of origin. In the Federal Council, the law has no
majority",1,0,0,1
2617,"Spain","2007-05-23","ABC","Print","La inmigración: oportunidad, no un problema","Immigration: opportunity, not a problem",1,0,1,0
2618,"Germany","2004-12-21","Frankfurter Rundschau","Print","Plädoyer für Integration   ;
Jüdische Gemeinde hat gewählt","Plea for integration;
Jewish community has chosen",0,1,0,0
2619,"Sweden","2016-05-05","Svenska Dagbladet","Print","Barn till migranter fick inte tas om hand","Children of migrants should not be taken care of",0,0,0,0
2620,"Romania","2015-09-12","Ziarul Financiar","Print","Viktor Orban: Imigranţii extracomunitari trebuie să revină în propriile ţări","Viktor Orban: Immigrants should endeavor to return to their own countries",0,0,0,0
2621,"Spain","2009-12-02","ABC","Print","Pacto por la Inmigración con todos los sindicatos","Pact for Immigration with all unions",0,0,0,0
2622,"Poland","2007-02-26","Gazeta Wyborcza","Print","Głodówka w areszcie straży granicznej","A hunger in border guards' custody",0,0,0,0
2623,"Romania","2013-12-17","Ziarul Financiar","Print","Topul ţărilor căutate de românii care vor să emigreze. Cea mai vânată ţară nu e Marea Britanie","Top countries sought Romanians to emigrate. The country is not hunted UK",1,1,0,0
2624,"Poland","2017-02-05","Gazeta Wyborcza","Print","Czy ĹĂłdĹş przyjmie rodzinÄ[TM] z Aleppo? BÄ[TM]dzie projekt uchwaĹ‚y","Will God accept the [TM] family from Aleppo? There will be a draft resolution",0,0,1,0
2625,"Hungary","2016-08-15","Magyar Idök","Print","Vona: Nemmel kell szavazni a referendumon","Vona: to vote 'no' in the referendum",0,0,0,0
2626,"Poland","2015-09-15","Gazeta Wyborcza","Print","Z Syrii do węgierskiego więzienia. Trzy lata dla nielegalnych imigrantów","From Syria to a Hungarian prison. Three years for illegal immigrants",0,0,0,1
2627,"Hungary","2015-09-04","Nepszabadsag","Print","Honosíthatták volna az egyik embercsempészt","One of the facilitators have Honosíthatták",0,0,0,1
2628,"Poland","2004-04-04","Gazeta Wyborcza","Print","Afera wizowa w Wielkiej Brytanii","The visa scandal in Great Britain",0,1,0,1
2629,"Spain","2006-07-09","El Pais","Print","Un héroe que se convirtió en el comandante de los inmigrantes","A hero who became the commander of immigrants",0,0,0,0
2630,"Spain","2007-02-15","El Mundo","Print","Los policias enviados a Mauritania denuncian el trato vejatorio que han
recibido de Interior.
Critican el abandono del Gobierno cuando fueron a identificar a los inmigrantes
del 'Marine I' Rajoy estima intolerable que se haya dejado a 100 agentes
durmiendo de mala manera en Nuadibu.","The police sent to Mauritania denounce the  vexatious treatment  that they have
received from Interior.
They criticize the abandonment of the Government when they went to identify the immigrants
of the 'Marine I' Rajoy considers intolerable that it has been left to 100 agents
Sleeping badly in Nouadibu.",0,0,1,1
2631,"Poland","2007-08-29","Rzeczpospolita","Print","Czy to koniec drenażu mózgów","Is this the end of brain drain",0,1,0,1
2632,"Romania","2014-08-18","Romania Libera","Print","60 de migranți irakieni și sirieni, aflați pe un iaht furat care se îndrepta spre România, reținuți de autoritățile bulgare","60 Iraqi and Syrian migrants on a stolen yacht headed for Romania, detained by the Bulgarian authorities",0,0,0,1
2633,"Poland","2016-05-24","Rzeczpospolita","Print","Opozycja bez paliwa","Opposition without fuel",0,0,0,0
2634,"Spain","2009-02-16","El Pais","Print","De Camerún a las listas del PP","From Cameroon to PP lists",0,0,0,0
2635,"Romania","2016-02-26","Ziarul Financiar","Print","Slovenia vrea să limiteze numărul migranţilor care-i tranzitează teritoriul la 580 pe zi","Slovenia wants to limit the number of migrants who transit through its 580 per day",0,0,0,0
2636,"Sweden","2011-04-05","Dagens Nyheter","Print","Indiska dataspecialister invandrar","Indian computer specialists are invading",0,1,0,0
2637,"Romania","2016-03-18","Ziarul Financiar","Print","Erdogan avertizează că UE se află pe un câmp minat în încercarea de a gestiona criza migraţiei","Erdogan warns that the EU is a minefield in crisis trying to manage migration",0,0,0,1
2638,"Hungary","2016-03-10","Magyar Hirlap","Print","„Egységes Európa kell a fennmaradáshoz","Europe must be unified to survive",0,0,0,0
2639,"UK","2015-12-24","The Daily Telegraph","Print","Christian values make Britain haven for all faiths, says Cameron","Christian values make Britain haven for all faiths, says Cameron",0,0,0,0
2640,"UK","2002-06-29","The Guardian","Print","Danes justify harshest asylum laws in Europe: The United Nations is questioning
the legality of Denmark's immigration rules to be passed on Monday","Danes justify harshest asylum laws in Europe: The United Nations is questioning
the legality of Denmark's immigration rules to be passed on Monday",0,1,1,1
