"id","country","publication_date","source","source_type","headline","headline_mt","m_fr_eco","m_fr_lab","m_fr_wel","m_fr_sec"
1756,"Romania","2016-02-03","Romania Libera","Print","DIICOT: Nu există o amenințare teroristă reală în România, dar trebuie urmărit valul de migrație","DIOCT: There is a real terrorist threat in Romania, but must follow the wave of migration",0,0,0,1
1757,"Romania","2016-02-29","Ziarul Financiar","Print","Peste 600 de imigranţi au fost deportaţi din Belgia în Franţa în ultima săptămână","Over 600 immigrants were deported from Belgium to France last week",0,0,0,1
1758,"Hungary","2017-01-28","Magyar Idök","Print","Hangszórókon informálnák az illegális bevándorlókat","Speakers informed of illegal immigrants",0,0,0,1
1759,"Hungary","2015-05-15","Nepszava","Print","Szó sem lehet az uniós kvóta bevezetéséről","There can be no imposition of EU quotas",0,0,0,1
1760,"Romania","2014-02-20","Jurnalul National","Print","Traian Băsescu, despre situaţia din Ucraina: România, pregătită să preia imigranţi","Traian Basescu about the situation in Ukraine: Romania, ready to take over immigrants",1,0,0,0
1761,"Hungary","2017-03-01","Magyar Hirlap","Print","Liberálisok és baloldaliak támadták Magyarországot az EP-ben","Liberals and leftists attacked Hungary in the EP",0,0,0,1
1762,"Sweden","2016-06-02","Dagens Nyheter","Print","Medierna måste bli öppnare","The media need to be more open",0,0,0,0
1763,"Spain","2009-01-13","El Pais","Print","46.426 'sin papeles' de 29 países, repatriados en 2008","46,426 'without papers' from 29 countries, repatriated in 2008",0,1,0,1
1764,"Sweden","2016-06-14","Svenska Dagbladet","Print","Alla vill inte vara politiska","Everyone does not want to be political",0,0,1,0
1765,"Spain","2017-01-15","El Mundo","Print","Nuevo drama en el Estrecho: Nos estamos hundiendo, vemos España","New drama in the Strait:  We are sinking, we see Spain",0,0,0,0
1766,"Sweden","2012-09-10","Aftonbladet","Print","Tuffa krav slår alltid på de sämst ställda","Tough demands always turn on the worst people",0,1,1,0
1767,"Germany","2017-07-19","Frankfurter Rundschau","Print","Zwischen Wohlstand und Armut","Between prosperity and poverty",1,1,1,0
1768,"Poland","2017-04-16","Gazeta Wyborcza","Print","Dwa niemieckie statki lada chwila mogą zatonąć na Morzu Śródziemnym. Na
pokładach mają setki uchodźców","Two German ships can sink in the Mediterranean at any moment. On
they have hundreds of refugees",0,0,0,0
1769,"UK","2017-09-07","The Guardian","Print","Second Innings: cricket for Afghan refugees in London;
The latest Guardian documentary takes us to a very special cricket club for
young Afghan refugee boys in London","Second Innings: cricket for Afghan refugees in London;
The latest Guardian documentary takes us to a very special cricket club for
young Afghan refugee boys in London",0,0,0,0
1770,"Spain","2016-03-21","El Pais","Print","Grecia necesita 4.000 expertos para garantizar los retornos","Greece needs 4,000 experts to guarantee returns",0,0,0,0
1771,"Germany","2016-01-02","taz","Print","Salafist im Kindergarten;
Unterwandern radikale Islamisten die muslimischen Kindergärten?","Salafist in kindergarten;
Are radical Islamists infiltrating Muslim kindergartens?",0,0,1,0
1772,"Poland","2013-01-21","Gazeta Wyborcza","Print","Tragiczny koniec porwania w Algierii","The tragic end of the kidnapping in Algeria",0,1,0,0
1773,"Romania","2014-01-10","Romania Libera","Print","Daily Mail: Imigrantul român ajuns celebru a dispărut fără urmă","Daily Mail: immigrant Romanian became famous disappeared without a trace",0,1,0,0
1774,"Sweden","2004-02-17","Expressen","Print","Dränkta av lagen.","Submerged by the law.",0,1,0,1
1775,"Germany","2016-10-02","Welt Online","Online","Sachsen;
Angriffe auf muslimische Einrichtungen nehmen zu","Saxony;
Attacks on Muslim institutions are increasing",0,0,0,0
1776,"Poland","2016-02-09","Rzeczpospolita","Print","Niemcy liczą na Turcję","Germany count on Turkey",0,0,0,0
1777,"Germany","2016-07-05","Frankfurter Rundschau","Print","Aufrütteln mit harten Parolen","Shake up with hard slogans",0,1,1,0
1778,"Sweden","2004-11-26","Expressen","Print","Äntligen - nu får de sitt klassfoto! Rektorn stoppade skolfotot med","At last - now they get their class photo! The rider stopped the school lottery",0,0,1,0
1779,"UK","2013-10-03","The Guardian","Print","Qatar: Migrant's story: Lured by a job, but driven to despair by accident and
two years of legal battles","Qatar: Migrant's story: Lured by a job, but driven to despair by accident and
two years of legal battles",0,1,1,0
1780,"UK","2016-06-03","telegraph.co.uk","Online","Michelle Obama tells Donald Trump in rare political speech: 'In America we don't
build walls'","Michelle Obama tells Donald Trump in rare political speech: 'In America we don't
build walls'",0,0,0,1
1781,"Poland","2013-07-16","Gazeta Wyborcza","Print","Czarnoskóra minister jak orangutan? Autor obelg we włoskim senacie odmawia
dymisji","Black minister like an orangutan? The author of the insults in the Italian Senate refuses
resign",0,0,0,0
1782,"Romania","2015-09-07","Evenimentul Zilei","Print","Bogdan Aurescu, chemat marţi la şedinţa coaliţiei pentru a discuta problema imigranţilor","Bogdan Aurescu on Tuesday called coalition meeting to discuss immigrants",0,0,0,0
1783,"Spain","2002-10-22","El Pais","Print","CRUZ ROJA DEJARA DE ATENDER A INMIGRANTES EN CANARIAS SI EL GOBIERNO NO LE PAGA
INTERIOR AFIRMA QUE PROMETIO LA SEMANA PASADA A LA ONG QUE SOLUCIONARA LA
SITUACION","RED CROSS WILL STOP SERVING IMMIGRANTS IN THE CANARY ISLANDS IF THE GOVERNMENT DOES NOT PAY
INTERIOR AFFIRMS THAT I PROMISED THE LAST WEEK TO THE NGO THAT WILL SOLVE THE
SITUATION",1,0,0,1
1784,"Spain","2016-10-25","El Pais","Print","Necesitamos mantas ahora, no en primavera","We need blankets now, not in spring",0,0,1,0
1785,"Sweden","2004-10-16","Dagens Nyheter","Print","Tjetjensk familj får stanna i Sverige . Utlänningsnämnden ändrar sig efter","Chechen family may stay in Sweden. The Aliens Board changes",0,0,0,0
1786,"Spain","2002-06-23","El Pais","Print","UNOS 100 ANTIGLOBALIZACION SE ENCIERRAN EN UNA IGLESIA EN APOYO DE LOS
INMIGRANTES LA PROTESTA COINCIDIO CON LA CELEBRACION DE UNA BODA EN EL SALVADOR","SOME 100 ANTI-GLOBALIZATION ARE FILLED INTO A CHURCH IN SUPPORT OF THE
IMMIGRANTS THE PROTEST COINCIDED WITH THE CELEBRATION OF A WEDDING IN EL SALVADOR",0,0,0,0
1787,"Romania","2013-12-26","Ziarul Financiar","Print","Edward Snowden a cerut încetarea monitorizării masive a comunicaţiilor, într-un mesaj de Crăciun","Edward Snowden asked massive stop monitoring communications in a Christmas message",0,0,0,1
1788,"Poland","2011-03-01","Rzeczpospolita","Print","Rząd szykuje się na desant z Afryki","The government is preparing for a landing from Africa",0,0,0,1
1789,"Sweden","2006-03-05","Svenska Dagbladet","Print","Fakta Jamaica blev","Facts Jamaica became",0,1,0,0
1790,"Sweden","2013-12-01","Aftonbladet","Print","Nu får de bo tillsammans","Now they can live together",0,0,0,0
1791,"Germany","2004-09-24","Frankfurter Rundschau","Print","Migration   ;
Für Pflicht zu Integration in Kitas und Schulheimen","Migration;
For compulsory integration into day-care centers and schoolhouses",0,0,1,0
1792,"UK","2016-01-18","telegraph.co.uk","Online","David Cameron backs bans on Muslim face veils as Tories plan crackdown on gender
segregation;
Prime Minister says it is 'proper and sensible' for Muslim women to remove face
veils when asked to by public officials","David Cameron backs bans on Muslim face veils as Tories plan crackdown on gender
segregation;
Prime Minister says it is 'proper and sensible' for Muslim women to remove face
veils when asked to by public officials",0,1,1,1
1793,"Spain","2014-02-18","El Pais","Print","Interior pedirá apoyo a la UE para mitigar la llegada de inmigrantes","Interior will ask for support to the EU to mitigate the arrival of immigrants",0,0,0,1
1794,"Hungary","2016-02-17","Magyar Hirlap","Print","Donald Tusk nem zárná ki a görögöket","Donald Tusk would not exclude the Greeks",0,0,0,0
1795,"Germany","2013-10-25","ZEIT Online","Online","Der reitende Bote in Lampedusa;
Wie der aufgeklärte Fürst von Anhalt-Dessau die Flüchtlinge in sein Land holte.
Eine unhaltbare Fantasie aus aktuellem Anlass","The riding messenger in Lampedusa;
As the enlightened prince of Anhalt-Dessau brought the refugees to his country.
An untenable fantasy from current occasion",1,1,1,0
1796,"Hungary","2016-05-26","Magyar Hirlap","Print","Bakondi György: A migráció intenzitása nem csökkent","György Bakondi: The migration intensity has not decreased",0,0,0,1
1797,"Romania","2015-09-03","Evenimentul Zilei","Print","Bogdan Aurescu: Împărţirea de cote de migranţi nu e singura soluţie la problema refugiaţilor , e important să tratăm sursa acesteia","Bogdan Aurescu: Dividing shares migrants is not the only solution to the problem of refugees , it is important to treat the source",0,0,0,0
1798,"Romania","2009-06-19","Ziarul Financiar","Print","Fostul director al Companiei de Cai Ferate, arestat in SUA","Former Director of Railways arrested in US",0,0,0,1
1799,"Hungary","2017-09-17","Magyar Hirlap","Print","Dél-Spanyolországban megnövekedett a migráció","Southern Spain increased migration",0,0,0,1
1800,"Spain","2006-01-31","El Pais","Print","Solidaridad con los 'sin techo' del Turia","Solidarity with the 'homeless' of the Turia",0,0,1,0
1801,"Sweden","2015-10-26","Svenska Dagbladet","Print","Svårt bevisa brott mot asylboenden","Difficult to prove crime against asylum residents",0,0,1,0
1802,"Spain","2008-09-18","ABC","Print","Peralta pide ahora solidaridad con la inmigración ilegal","Peralta now calls for solidarity with illegal immigration",0,0,0,0
1803,"Germany","2006-08-09","taz","Print","Ärger mit den Auflagen;
Das Amtsgericht Hildesheim verurteilt Kai Weber vom Niedersächsischen
Flüchtlingsrat zu einer Geldstrafe. Er hätte die Teilnehmer einer Demonstration
davon abhalten müssen, die Stufen der Jakobikirche in der Innenstadt zu betreten","Trouble with the pads;
The district court Hildesheim condemns Kai Weber of Lower Saxony
Refugee Council to a fine. He would have the participants in a demonstration
prevent them from entering the steps of the Jacobi church in the city center",0,0,0,0
1804,"Poland","2015-05-29","Rzeczpospolita","Print","Misja wysokiego ryzyka","Mission High Risk",0,0,1,0
1805,"Sweden","2006-01-13","Dagens Nyheter","Print","Mamma vägras visum till sin mördade sons begravning","Mum is refused visa to his murdered son's funeral",0,0,0,0
1806,"Romania","2015-04-22","Ziarul Financiar","Print","Numărul imigranţilor din Spania, inclusiv al românilor, a scăzut în 2014, al treilea an la rând","The number of immigrants in Spain, including Romanians fell in 2014, the third year in a row",1,1,0,0
1807,"Romania","2016-02-29","Ziarul Financiar","Print","Până la 70.000 de migranţi ar putea rămâne blocaţi în Grecia, avertizează Atena","Up to 70,000 migrants could remain stuck in Greece, warns Athens",0,0,0,1
1808,"UK","2015-06-11","The Daily Telegraph","Print","Syrian refugees flee from renewed fight against Isil;
Border chaos","Syrian refugees flee from renewed fight against Isil;
Border chaos",0,0,1,0
1809,"Hungary","2016-03-24","Magyar Idök","Print","Korlátozásokat hozhat a terror az alapvető szabadságjogok terén","Restrictions bring terror on fundamental freedoms",0,0,0,0
1810,"Romania","2016-09-28","Ziarul Financiar","Print","Patru ţări central-europene nu au primit niciun refugiat în cadrul sistemului cotelor obligatorii","Four central European countries received no refuge in the mandatory quota system",0,0,0,0
1811,"Poland","2014-05-08","Rzeczpospolita","Print","USA przykładem dla Europy","US example for Europe",0,1,0,0
1812,"Germany","2014-12-09","Frankfurter Rundschau","Print","Patienten zweiter Klasse","Second-class patients",1,1,1,0
1813,"Hungary","2015-09-07","Nepszava","Print","Az „Ígéret földje nem Magyarország","The Promised Land is not Hungary",0,0,0,0
1814,"UK","2016-02-04","The Guardian","Print","Criminals with UK children cannot be automatically deported, says EU court;
Theresa May told she cannot expel Moroccan woman with British-born son simply
because of conviction","Criminals with UK children cannot be automatically deported, says EU court;
Theresa May told she cannot expel Moroccan woman with British-born son simply
because of conviction",0,0,0,1
1815,"Germany","2014-12-03","taz","Print","Kiel erlässt Abschiebestopp","Kiel issues deportation stop",0,0,0,0
1816,"Sweden","2015-11-21","Aftonbladet","Print","Källa: S kan försätta landet i kristillstånd","Source: S can put the country in Christianity",0,0,0,0
1817,"Sweden","2005-11-28","Dagens Nyheter","Print","Ingen rubrik","No headline",1,0,1,1
1818,"Poland","2007-12-20","Gazeta Wyborcza","Print","Jesteśmy w Schengen: Europa od Bugu po Atlantyk","We are in Schengen: Europe from the Bug to the Atlantic",0,0,1,0
1819,"UK","2016-10-07","mirror.co.uk","Online","Shameless Tory Amber Rudd slammed by her own BROTHER for 'appalling' attack on
foreign workers;
PR chief Roland Rudd slammed the Government following his sister's plan to force
firms to publish lists of all foreign staff","Shameless Tory Amber Rudd slammed by her own BROTHER for 'appalling' attack on
foreign workers;
PR chief Roland Rudd slammed the Government following his sister's plan to force
firms to publish lists of all foreign staff",1,1,0,0
1820,"UK","2016-09-20","mirror.co.uk","Online","Theresa May set to defend Brexit as she addresses world leaders in New York
today;
Mrs May will also tell leaders new threats such as global terrorism, mass
migration and modern slavery need an international response","Theresa May set to defend Brexit as she addresses world leaders in New York
today;
Mrs May will also tell leaders new threats such as global terrorism, mass
migration and modern slavery need an international response",0,0,0,1
1821,"Romania","2015-09-08","Ziarul Financiar","Print","Autorităţile ungare anunţă că au înregistrat 169.337 de imigranţi ilegali","The Hungarian authorities announced that 169 337 registered for ' immigrants illegal",0,0,0,1
1822,"Sweden","2015-07-10","Dagens Industri","Print","131","131",0,0,1,0
1823,"Spain","2008-04-15","El Pais","Print","La derecha barre en el Norte","The right sweeps in the North",0,1,0,0
1824,"Poland","2013-01-18","Gazeta Wyborcza","Print","Polska nie chce Kurda","Poland does not want Kurd",0,1,0,0
1825,"Hungary","2017-12-07","Magyar Hirlap","Print","Szobrok, sorsok","Sculptures, fates",0,0,0,0
1826,"Spain","2013-12-06","El Pais","Print","Vidas perras","Lives bitches",0,0,0,0
1827,"Poland","2005-12-16","Rzeczpospolita","Print","Ograniczenia dla gastarbeiterów","Limitations for guest workers",0,1,0,0
1828,"Hungary","2016-09-02","Nepszabadsag","Print","Clinton lapít és várja, hogy Trump újabb hibát vétsen","Clinton flatten and looking forward to another mistake Trump Vets",0,0,0,1
1829,"Sweden","2006-07-11","Svenska Dagbladet","Print","Avvisad hällde bensin över sig","Rejected poured gasoline over",0,0,1,0
1830,"Sweden","2002-04-20","Svenska Dagbladet","Print","Ryska rasisters framfart skrämmer utlänningar","Russian racists' horror scares foreigners",0,0,0,0
1831,"Romania","2016-10-10","Ziarul Financiar","Print","FIFA a fost dată în judecată de un muncitor de la şantierul pentru Cupa Mondială din Qatar 2022","FIFA has been sued by a worker at the site for the World Cup in Qatar in 2022",0,1,0,0
1832,"UK","2014-11-28","Daily Mirror","Print","WARSAW PACKED;
SCANDAL OF CHEAP FOREIGN STAFF Hundreds of Polish workers bussed in to Next site
in an area of high unemployment EXCLUSIVE","WARSAW PACKED;
SCANDAL OF CHEAP FOREIGN STAFF Hundreds of Polish workers bussed in to Next site
in an area of high unemployment EXCLUSIVE",1,1,0,0
1833,"Spain","2009-08-22","ABC","Print","Detenidos once inmigrantes tras la llegada de otras dos pateras a Alicante El
Gobierno retrasa de septiembre a «finales de año» la puesta en marcha de los
radares","Eleven immigrants arrested after the arrival of two other boats to Alicante
Government delays September to end of the year the implementation of the
radars",0,0,0,1
1834,"Romania","2017-05-16","Romania Libera","Print","GALERIE FOTO. Migranți irakieni, opriţi la frontiera cu Bulgaria. Voiau să ajungă în Germania","PHOTO GALLERY. Migrants Iraqis stopped at the border with Bulgaria. They wanted to get to Germany",0,0,0,1
1835,"Romania","2013-12-04","Ziarul Financiar","Print","Premierul Marii Britanii sugerează că planurile de a împiedica migraţia românilor şi bulgarilor ar putea să nu funcţioneze","Britain's prime minister suggested that plans to prevent migration of Romanians and Bulgarians could not work",1,1,1,0
1836,"Germany","2003-04-07","taz","Print","was bisher geschah;
Eine politische Familie auf der Flucht","what happened until now;
A political family on the run",0,1,1,0
1837,"Hungary","2015-06-06","Nepszava","Print","Történet a kiszolgáltatottságról","History of vulnerable reality",0,0,0,0
1838,"Sweden","2001-04-30","Dagens Nyheter","Print","Fängelse bättre miljö än flyktingförvar","Prison better environment than refugee shelter",0,0,1,1
1839,"Hungary","2016-12-02","Magyar Hirlap","Print","ENSZ: Közel 27 ezren menekültek el az aleppói harcok elől","UN: Nearly 27 thousand people fled the fighting in Aleppo Tires",0,0,1,0
1840,"Poland","2014-10-30","Gazeta Wyborcza","Print","A uchodźcy wciąż toną na Morzu Śródziemnym","And refugees are still drowning in the Mediterranean",1,0,0,1
1841,"Poland","2007-10-28","Gazeta Wyborcza","Print","Cudzoziemcy chcą uczyć się polskiego","Foreigners want to learn Polish",0,1,1,0
1842,"Germany","2005-03-07","taz","Print","Gewalt im Namen der Ehre gibt es nicht;
1.000 Menschen demonstrierten am Samstag gegen Gewalt an Frauen. Anlass war der
Mord an der 23-jährigen Hatun Sürücü. Die meisten Teilnehmer waren weiblich und
weiß. Der MigrantInnenanteil war gering, Männer fehlten","Violence in the name of honor does not exist ;
1,000 people demonstrated against violence against women on Saturday. The occasion was the
Murder of 23-year-old Hatun Sürücü. Most participants were female and
White. The proportion of migrants was low, men were missing",0,0,0,1
1843,"Hungary","2016-09-21","Magyar Hirlap","Print","„A bevándorlási hullám felelőtlen kezelése a legnagyobb veszélyt a nőkre jelenti","The immigration irresponsible handling wave poses the greatest threat to women '",0,0,0,1
1844,"Poland","2007-10-23","Gazeta Wyborcza","Print","Zmarł Jan Krok-Paszkowski","Jan Krok-Paszkowski died",0,1,0,0
1845,"Sweden","2003-02-19","Svenska Dagbladet","Print","Lena Lindgren","Lena Lindgren",0,0,0,0
1846,"Germany","2015-12-22","Frankfurter Rundschau","Print","Schwedische Bahn stoppt Zugverkehr aus Dänemark","Swedish train stops train traffic from Denmark",0,0,0,0
1847,"UK","2015-04-24","telegraph.co.uk","Online","'Smuggler captain' accused over worst Mediterranean sinking appears in court;
27-year-old Tunisian suspected of sinking smuggler boat on which 800 drowned is
in court in Sicilty, where judge is due to decide whether to confirm his arrest","'Smuggler captain' accused over worst Mediterranean sinking appears in court;
27-year-old Tunisian suspected of sinking smuggler boat on which 800 drowned is
in court in Sicilty, where judge is due to decide whether to confirm his arrest",0,0,0,1
1848,"Hungary","2015-03-14","Nepszabadsag","Print","Égből a Merkel","Merkel sky",0,0,0,1
1849,"Sweden","2014-08-27","Dagens Nyheter","Print","Redovisa intäkter från äldre","Reporting income from the elderly",1,1,0,0
1850,"UK","2015-11-17","The Guardian","Print","Students skip classes to show support for refugees;
Nationwide demonstration over government's treatment of refugees includes mass
walkout, talks and demonstration outside Daily Mail headquarters","Students skip classes to show support for refugees;
Nationwide demonstration over government's treatment of refugees includes mass
walkout, talks and demonstration outside Daily Mail headquarters",0,0,1,0
1851,"Hungary","2017-06-12","Magyar Idök","Print","Ismét nagyobb csoportokban érkeznek a határsértők","Again, large groups of violators to arrive",0,0,0,1
1852,"Spain","2013-12-17","ABC","Print","Los «tories» plantean limitar el número de inmigrantes en la UE;
Fuertes críticas a la posibilidad de reducir las llegadas a 75.000 comunitarios
al año","The «Tories» propose limiting the number of immigrants in the EU;
Strong criticism of the possibility of reducing arrivals to 75,000 EU citizens
year",0,1,0,0
1853,"Spain","2009-07-05","ABC","Print","El limbo de los refugiados","The limbo of the refugees",0,1,0,0
1854,"UK","2016-10-18","The Guardian","Print","UK-French blame game over Calais camp must end, says Cazeneuve;
Interior minister says there have been misunderstandings on each side but both
must take responsibility for crisis","UK-French blame game over Calais camp must end, says Cazeneuve;
Interior minister says there have been misunderstandings on each side but both
must take responsibility for crisis",0,0,0,0
1855,"Romania","2017-08-17","Evenimentul Zilei","Print","Călăuzele migranților irakieni, băgate după gratii de procurorii din Constanța","Guides migrants Iraqis swept behind bars prosecutors from Constanta",0,0,0,1
1856,"Poland","2007-05-09","Rzeczpospolita","Print","CDU broni wysiedlonych","CDU weapons displaced",0,0,0,0
1857,"Germany","2008-10-13","Die Welt","Print","Umstrittener CDU-Ortschef tritt von allen Ämtern zurück","Controversial CDU chief resigns from all offices",0,0,0,0
1858,"UK","2017-04-20","telegraph.co.uk","Online","Use £12bn foreign aid budget to pay down the deficit, says former Tory policy
chief","Use £12bn foreign aid budget to pay down the deficit, says former Tory policy
chief",1,0,1,0
1859,"Spain","2003-07-24","El Pais","Print","Los inmigrantes podran seguir todo el verano en los cuarteles de Sant Andreu","Immigrants can continue all summer in the barracks of Sant Andreu",0,0,1,1
1860,"UK","2016-05-28","The Daily Telegraph","Print","Gentler touch as EU rivals seek rural vote;
Europe 2016 ; David Cameron vows to drop personal attacks for last 30 days of EU
referendum campaign","Gentler touch as EU rivals seek rural vote;
Europe 2016 ; David Cameron vows to drop personal attacks for last 30 days of EU
referendum campaign",1,1,0,0
1861,"Germany","2016-09-15","taz","Print","Mit erweitertem Blick;
Wahl In Berlin ist es längst Alltag: KandidatInnen mit Migrationshintergrund
bewerben sich um Mandate auf Landes- und Bezirksebene. Aber welche Rolle spielt
ihre Herkunft?","With an expanded view;
Wahl It has long been everyday life in Berlin: candidates with a migration background
apply for mandates at state and district level. But what role does play
Your origin?",0,1,1,0
1862,"Poland","2014-10-23","Gazeta Wyborcza","Print","ONZ: liczba uchodźców na Ukrainie przekroczyła 430 tysięcy. Większość to
uciekinierzy z Donbasu","UN: the number of refugees in Ukraine exceeded 430 thousand. Most of it
refugees from Donbass",0,0,0,0
1863,"Hungary","2017-08-15","Magyar Hirlap","Print","Merkel még nem gondol a koalícióra","Merkel did not even think about the coalition",0,0,0,0
1864,"UK","2016-03-09","The Guardian","Print","Canada doubles refugee target to 57,000 by the end of this year;
Minister says Canada will step up efforts take in refugees from around the
world, in addition to the 26,000 from Syria it has welcomed over the past three
months","Canada doubles refugee target to 57,000 by the end of this year;
Minister says Canada will step up efforts take in refugees from around the
world, in addition to the 26,000 from Syria it has welcomed over the past three
months",1,0,0,0
1865,"Spain","2015-02-28","El Pais","Print","Los favoritos","The favorites",0,0,0,0
1866,"Poland","2017-08-16","Rzeczpospolita","Print","Import pracowników z Unii","Imports Union workers",0,1,0,0
1867,"Spain","2004-09-27","El Pais","Print","Los ciudadanos apoyan las reformas sociales de Zapatero","The citizens support the social reforms of Zapatero",0,1,0,0
1868,"Poland","2004-10-26","Gazeta Wyborcza","Print","Kto po Hancocku? Zagar? Lindbaek?","Who after Hancock? Zagar? Lindbaek?",0,1,0,0
1869,"Spain","2004-06-09","El Mundo","Print","El PP pide las comparecencias de Alonso y Caldera.","The PP requests the appearances of Alonso and Caldera.",0,0,0,0
1870,"Hungary","2016-10-03","Nepszabadsag","Print","Hatalmas árat fizettünk Orbán sötét lelkű műsoráért","Orban paid a huge price for sinister program",0,0,0,0
1871,"UK","2014-12-16","Metro","Print","Miliband pledges to tackle those exploiting migrants","Miliband pledges to tackle those exploiting migrants",0,1,0,0
1872,"Romania","2015-09-18","Romania Libera","Print","Blaga: România trebuie să fie pregătită pentru CREŞTEREA numărului de refugiaţi alocaţi","Blaga: Romania should be prepared to increase the number of refugees allocated",1,0,1,0
1873,"Spain","2017-06-19","El Pais","Print","Empieza la negociación en Bruselas","The negotiation in Brussels begins",0,0,0,0
1874,"Sweden","2004-11-11","Svenska Dagbladet","Print","Dumhetens ombud feltolkar Jantelagen","The dumbness's ombudsman misinterpretes the Jantelagen",0,0,0,0
1875,"Romania","2008-05-13","Ziarul Financiar","Print","Tariceanu i-a cerut lui David sa plece urgent la Roma pentru a clarifica problema imigrantilor romani","Tariceanu asked David to go urgently to Rome to clarify the issue of immigrants Romanians",0,0,0,1
1876,"Hungary","2017-01-25","Magyar Hirlap","Print","A végét járhatja az osztrák kormány","The end may be impressed by the Austrian Government",0,0,0,1
